Record ID,who Name,who Content,Whop Community Name
db9d4bd9-98f1-466f-9296-9cefc850c290,Débutants en Trading,Cherchant à apprendre une méthode simple et efficace pour débuter dans le day trading.,Cours Trading Modèle A à Z
db9d4bd9-98f1-466f-9296-9cefc850c290,Traders Intermédiaires,Souhaitant affiner leurs compétences avec des techniques éprouvées et un soutien personnalisé.,Cours Trading Modèle A à Z
db9d4bd9-98f1-466f-9296-9cefc850c290,Investisseurs Ambitieux,Prêts à accéder à un capital de 50 000 $ et à maximiser leurs profits grâce à des stratégies avancées.,Cours Trading Modèle A à Z
729ab2d9-acbb-4a89-a30d-8f7dfd67ed7e,Aspiring Traders,Eager to learn the ins and outs of stock and futures trading in a supportive community.,CheckMate Trading™
729ab2d9-acbb-4a89-a30d-8f7dfd67ed7e,Experienced Investors,Looking to refine their strategies with advanced market analysis and trade alerts.,CheckMate Trading™
729ab2d9-acbb-4a89-a30d-8f7dfd67ed7e,Part-time Traders,Seeking efficient strategies and alerts to maximize trading returns with limited time.,CheckMate Trading™
729ab2d9-acbb-4a89-a30d-8f7dfd67ed7e,Options Enthusiasts,Interested in generating income through strategic options selling.,CheckMate Trading™
10db7154-6076-43ec-b9b9-dd8cfdc041d3,Początkujący Traderzy,Chcący zdobyć solidne podstawy i zrozumienie rynku od podstaw.,ᴄᴏʀᴇ 🪬 🕉️
10db7154-6076-43ec-b9b9-dd8cfdc041d3,Zaawansowani Inwestorzy,Szukający zaawansowanych strategii i modeli zarządzania ryzykiem.,ᴄᴏʀᴇ 🪬 🕉️
10db7154-6076-43ec-b9b9-dd8cfdc041d3,Profesjonalni Traderzy,Pragnący doskonalić swoje umiejętności i psychologię tradingu.,ᴄᴏʀᴇ 🪬 🕉️
2348232b-f7de-4b12-aba8-2c847c206285,Początkujący Traderzy,Chcący zdobyć solidne podstawy i zrozumienie rynku od podstaw.,ᴄᴏʀᴇ 🪬 🕉️
2348232b-f7de-4b12-aba8-2c847c206285,Zaawansowani Inwestorzy,Szukający zaawansowanych strategii i modeli zarządzania ryzykiem.,ᴄᴏʀᴇ 🪬 🕉️
2348232b-f7de-4b12-aba8-2c847c206285,Profesjonalni Traderzy,Pragnący doskonalić swoje umiejętności i psychologię tradingu.,ᴄᴏʀᴇ 🪬 🕉️
9071084e-3a48-4d3c-a24e-a36b952cf789,Aspiring Traders,Eager to learn from seasoned pros and enhance their skills with real-time trading guidance.,VIP Trader Access
9071084e-3a48-4d3c-a24e-a36b952cf789,Ambitious Beginners,Ready to commit to advanced tools and resources to fast-track their trading success.,VIP Trader Access
9071084e-3a48-4d3c-a24e-a36b952cf789,Growth-Focused Traders,Eager to accelerate their journey by leveraging professional insights and proven strategies.,VIP Trader Access
9071084e-3a48-4d3c-a24e-a36b952cf789,Serious Traders,"Dedicated to refining their skills with live trading, real-time signals, and expert mentorship.",VIP Trader Access
