Record ID,Offer Name,Type of Offer,Offer Details,Offer Price,Whop Community Name
b27b9b1d-a1af-46f6-a28a-b5a1609f6d9f,Futures Traders 1to1,Single payment,"-Accès à un chat premium avec des traders utilisant la même méthode.,   -Possibilité de trader directement depuis TradingView.,   -10 leçons pour maîtriser une méthode simple sans indicateurs.,   -80% de taux de réussite avec notre méthode.,   -Support disponible sur Discord pour toutes vos questions.,   ",€49.00 for 1-month access,Futures Traders 1to1
b27b9b1d-a1af-46f6-a28a-b5a1609f6d9f,Futures Traders 1to1,Single payment,"-Accès au PREMIUM CHAT pour échanger avec d'autres traders.,   -10 leçons pour maîtriser une méthode simple et efficace.,   -Support sur Discord pour toutes vos questions.,   ",€97.00 for 1-month access,Futures Traders 1to1
66cc02e6-cf11-4a22-88ff-ed9597ea978c,Acecard Free Community,,"-Participate in live trading workshops to practice in real-time market environments.,   -Access to real-time trading signals to capitalize on market opportunities confidently.,   -Round-the-clock support from mods, analysts, and other members to ensure success.,   -Engage in weekly masterclass sessions with seasoned mentors.,   -Explore investment opportunities for long-term wealth and substantial returns.,   ",Free lifetime,Acecard Trading
66cc02e6-cf11-4a22-88ff-ed9597ea978c,Acecard Trading,Single payment,"-Advanced Course for beginners and seasoned experts alike.,   -Real-time Forex and Crypto trading signals for informed decisions.,   -Access to passed funded accounts at reduced costs.,   -Weekly masterclasses with seasoned mentors.,   -Live trading workshops in real-time market environments.,   ",$350.00 lifetime,Acecard Trading
02e012be-c10d-4397-a69e-e286307181b0,FXA Trading Signals,,"-Access to the FXA Video Course platform for comprehensive learning.,   -Receive over 15 signals per week on XAUUSD, BTCUSD, US30, and more.,   -Consult with our trading psychology coach for personalized advice.,   ",Free lifetime,FXA Trading Signals
02e012be-c10d-4397-a69e-e286307181b0,FXA Trading Signals Academy,Subscription,"-Over 15 signals weekly on XAUUSD, BTCUSD, and more.,   -Access to FXA Video Course platform for in-depth learning.,   -Personalized support and trading psychology consultations.,   -Join a community of technical analysts with over 5 years of experience.,   ",$250.00 / month,FXA Trading Signals
fe9e48c8-b313-4be8-93b3-24cd305d3a2d,ItsYodaTrades Spectator,Waitlist,"-Live Trading Challenge to $1.2M capital with every strategy shared.,   -Access to comprehensive charts and expert mentorship for skill refinement.,   -Daily, Weekly, and Monthly Analysis for insightful trading decisions.,   -Join an exclusive community of skilled traders for collaboration.,   -Step-by-step guide to becoming a funded trader in prop trading.,   ",Free lifetime,ItsYodaTrades Spectator
fe9e48c8-b313-4be8-93b3-24cd305d3a2d,ItsYoda Trades Trading,Waitlist,"-Join the $10k to $200k live trading challenge.,   -Access to daily, weekly, and monthly market analysis.,   -Step-by-step guide to become a funded trader.,   -Exclusive community of thriving traders.,   -Invest in legendary and emerging markets.,   ",$3.00 / month,ItsYodaTrades Spectator
f6793ec6-52d8-4245-aa02-b4fde8a55edd,Fractal Time Free Community,,"-Tägliches Live Trading mit Coaching,   -24/7 Support von mir und der Community,   -Lerne, News im Markt richtig vorherzusehen,   ",Free lifetime,Fractal Time
f6793ec6-52d8-4245-aa02-b4fde8a55edd,Fractal Time,Subscription,"-Tägliche Live-Trading-Sitzungen mit Echtzeit-Strategien,   -24/7 Support durch mich und die Community,   -Individuelle Beratung und Coaching verfügbar,   -Lerne, News im Markt richtig vorherzusehen,   -Bestehe Prop Firm Challenges schnell und effizient,   ",$100.00 / month,Fractal Time
f6793ec6-52d8-4245-aa02-b4fde8a55edd,Fractal Time,Single payment,"-Tägliche Live-Trading-Sitzungen mit Echtzeit-Strategien,   -24/7 Support durch mich und die Community,   -Individuelle Beratung und Coaching verfügbar,   ",€599.00 for 1-year access,Fractal Time
e15d673b-af5d-4ca0-a782-dd4e4d8e77cc,Pinnacle Trades FREE Discord,,"-Beginner trading guide to kickstart your journey,   -Access to free trading alerts and signals,   -Engage with a community of like-minded individuals,   -Stay updated with news alerts and prop firm info,   ",Free lifetime,Pinnacle Trades Lifetime
e15d673b-af5d-4ca0-a782-dd4e4d8e77cc,Pinnacle Trades VIP,Subscription,"-Access to our VIP Futures, Forex, Index, and Commodity signals.,   -Full access to VIP chat and exclusive community of traders.,   -24/7 support and expert education resources for all members.,   ",$10.99 / week,Pinnacle Trades Lifetime
e15d673b-af5d-4ca0-a782-dd4e4d8e77cc,Pinnacle Trades Lifetime,Single payment,"-Lifetime access to VIP Discord with exclusive trading discussions.,   -Comprehensive trading e-books, guides, and educational resources.,   -1-1 personalized mentorship with seasoned traders.,   -24/7 support from our dedicated team of trading experts.,   -Access to all real-time trades as they are executed.,   ",$479.00 lifetime,Pinnacle Trades Lifetime
e15d673b-af5d-4ca0-a782-dd4e4d8e77cc,Pinnacle Trades Guide,,"-Comprehensive education from novice to master copytrader.,   -24/7 support from our dedicated team.,   ",Free lifetime,Pinnacle Trades Lifetime
e15d673b-af5d-4ca0-a782-dd4e4d8e77cc,Pinnacle Trades E-Book,Single payment,,$7.99 lifetime,Pinnacle Trades Lifetime
2eede88c-6574-42d4-b36e-fc2836cb898d,NBA - Signals Free Community,,"-Daglige signaler med 1-2 setups hverdag,   -Tilgang til private livesessions kun for medlemmer,   -24/7 support for alle medlemmer,   ",Free lifetime,NBA - Signals Free Community
2eede88c-6574-42d4-b36e-fc2836cb898d,Millionprogrammet,Subscription,"-Daglige signaler med 1-2 setups hverdag,   -24/7 support for alle dine spørsmål,   -Private livesessions kun for medlemmer,   ","kr4,000.00 / year",NBA - Signals Free Community
ec796251-b0d1-464b-899f-428110fc0ef5,KurrencyFreaks Free Course,,"-Access to daily live trading sessions from 9am-12pm EST.,   -Weekend backtesting sessions and market analysis breakdowns.,   -Engage with a community of like-minded traders for feedback.,   -Learn exact trading strategies and what to look for in markets.,   ",Free lifetime,KurrencyFreaks Free Course
ec796251-b0d1-464b-899f-428110fc0ef5,KurrencyFreaks VIP,Subscription,"-Access to daily live trading sessions, Monday-Friday.,   -Comprehensive blueprint trading course included.,   -Receive weekly backtesting sessions and updated analysis.,   -Full access to exclusive trading signals and calls.,   ",$29.99 / month,KurrencyFreaks Free Course
2472d062-d9a9-473d-91ae-acb37a27802f,SHEEN SPOT ASIA Dividers,,"-Includes ASIA Session and 90-minute cycle indicators.,   -Access to a dedicated Telegram support group for insights and discussions.,   -Enjoy free updates whenever improvements or new features are added.,   ",Free lifetime,SHEEN SPOT ASIA Dividers
2472d062-d9a9-473d-91ae-acb37a27802f,SHEEN SPOT SMT Cycles,Subscription,"-Access to premium SMT divergence signals for multiple timeframes.,   -Free updates with new features and improvements.,   -Join a Telegram support group for insights and discussions.,   ",$50.00 / 3 months,SHEEN SPOT ASIA Dividers
2472d062-d9a9-473d-91ae-acb37a27802f,SHEEN SPOT Macros,Subscription,"-Indicator for futures and FX with 🔥 insights,   -Enjoy free updates as we enhance our scripts 😀,   -Join our Telegram support group for insights ❓,   ",$8.00 / 6 months,SHEEN SPOT ASIA Dividers
2472d062-d9a9-473d-91ae-acb37a27802f,SHEEN SPOT Orderblocks,Subscription,"-Plots Local Orderblocks dynamically on all timeframes,   -Access to a supportive Telegram group for discussions and queries,   -Enjoy free updates when improvements or new features are added,   ",$10.00 / month,SHEEN SPOT ASIA Dividers
2472d062-d9a9-473d-91ae-acb37a27802f,SHEEN SPOT Structure EQ,Subscription,"-Indicator for futures and FX markets 🔥,   -Free updates with new features and improvements 😀,   -Access to a dedicated Telegram support group ❓,   ",$15.00 / month,SHEEN SPOT ASIA Dividers
2472d062-d9a9-473d-91ae-acb37a27802f,SHEEN SPOT TAPDA Signals,Subscription,"-Includes index futures indicators for superior trading insights.,   -Enjoy free updates ensuring tools remain cutting-edge.,   -Access our Telegram support group for expert advice and community support.,   ",$32.00 / month,SHEEN SPOT ASIA Dividers
2472d062-d9a9-473d-91ae-acb37a27802f,SHEEN SPOT Toolbox,Single payment,"-Access to index futures indicators for both futures and FX markets.,   -Free updates to the script when improvements or new features are added.,   -Join a Telegram support group for discussions and questions on the tools.,   ",$150.00 for 6-month access,SHEEN SPOT ASIA Dividers
2472d062-d9a9-473d-91ae-acb37a27802f,SHEEN SPOT Mentorship,Subscription,"-Index futures and FX indicators for strategic trading.,   -Free updates ensuring you always have the latest features.,   -Access to a vibrant Telegram support group for insights.,   ","$1,500.00 / 3 months",SHEEN SPOT ASIA Dividers
2472d062-d9a9-473d-91ae-acb37a27802f,The SheenSpot Mentorship,Single payment,"-3 months access to the mentorship,   -Access to a Telegram support group for real-time discussions,   -Smart Money/ICT concepts unlocked in ways unseen elseware!,   -from the ground up, all the bits and pieces that were left to solve.. served up,   -eliminate guess work, and READ the markets !,   ","$1,500.00 for 3-month access",SHEEN SPOT ASIA Dividers
ed8fa178-620a-4215-9657-1f24f501bc22,Benet Profits Learning,Subscription,"-Pre-market, intra-day, and post-trade routines for success.,   -Scalping and swing trading strategies tailored for index futures.,   -Regular group Q&A sessions to tackle market questions.,   ",$99.00 / month,Benet Profits Complete
ed8fa178-620a-4215-9657-1f24f501bc22,Benet Profits Complete,Subscription,"-Live trading sessions with real-time analysis and shared trade execution.,   -1-on-1 mentorship for personalized trading guidance.,   -Comprehensive trading strategies for scalping, day trading, and swing trading.,   -Regular group Q&A sessions for market event discussions.,   -Opportunities for feedback through student showcase sessions.,   ",$249.00 / month,Benet Profits Complete
ed8fa178-620a-4215-9657-1f24f501bc22,Benet Profits Lifetime Premium,Single payment,"-Live trading sessions with real-time analysis and trade execution,   -Comprehensive trading strategies tailored for index futures,   -1-on-1 mentorship for personalized, in-depth guidance,   -Access to group Q&A sessions and collaborative feedback,   -Lifetime access to all trading resources and community,   ",$999.00 lifetime,Benet Profits Complete
7b9ce93e-7754-43b3-a620-0839e2ef0780,Marshall Forex Community,Waitlist,"-Access to free, accurate forex signals for informed trading decisions.,   -Join an exclusive community for insights, support, and shared learning.,   -Receive real-time updates and expert analysis to stay ahead in the market.,   -Utilize detailed trading levels for meticulous trade management.,   -Enhance your forex knowledge with educational resources.,   ",Free lifetime,Marshall Forex Community
7b9ce93e-7754-43b3-a620-0839e2ef0780,Marshall Forex Bootcamp,Waitlist,"-Access to Accurate Forex Signals for informed trading decisions.,   -Engage with a Premium Forex Community of seasoned traders.,   -Comprehensive Forex Masterclass Course included.,   ",Free lifetime,Marshall Forex Community
92647261-4355-49f6-bdb6-fbe84a12e9c7,Cool Trading Lemon Pro,Single payment,"-Downloadable day trading tools including PnL calendar,   -Automatic calculated payslips designed for self-employed,   -Access to top 3 high-performance trading strategies,   -Includes my favorite indicator and exclusive extras,   -Learn from over 100+ profitable trades,   ",$41.50 lifetime,Cool Trading Lemon Pro
92647261-4355-49f6-bdb6-fbe84a12e9c7,Cool Trading Lemon Pro Tools,Single payment,"-1.5 hours of advanced day trading education,   -Access to a red and green P&L day trading calendar,   -Learn my top 3 high-performance trading strategies,   -Includes my favorite trading indicator,   -Over 100 profitable trade examples to study,   ",$599.00 lifetime,Cool Trading Lemon Pro
9b6c4d27-6c44-4bd5-815a-ab29697ce23f,Blue Vision FX Mentorship,Single payment,"-Access to private 1-on-1 training sessions at no extra cost.,   -Full access to the premium Forex Mastery Course Program.,   -Direct 24/7 support from mentors for training and trading.,   -Access to a community of Blue Vision traders.,   -Exclusive access to trading software and forex brokers.,   ",$299.00 lifetime,Blue Vision FX
9b6c4d27-6c44-4bd5-815a-ab29697ce23f,Blue Vision FX Signals,Subscription,"-Access to live market education and deep trading analysis.,   -24/7 support and direct access to mentors for guidance.,   -Join a private group of Blue Vision traders for networking.,   -Full access to our premium Forex Mastery Course.,   -Receive real-time updates on trade entries and exits.,   ",$55.00 / month,Blue Vision FX
9b6c4d27-6c44-4bd5-815a-ab29697ce23f,Blue Vision FX Consultation,Single payment,"-Direct one-on-one private live call with BV4REX,   -Full access to our premium Forex Mastery Course,   -Access to private 1-on-1 training sessions at no extra cost,   -Join our exclusive trading family and community,   -24/7 mentor support and access to trading software,   ",$49.99 for 1-day access,Blue Vision FX
9b6c4d27-6c44-4bd5-815a-ab29697ce23f,Blue Vision FX MRTD,Single payment,"-Advanced Risk Systems and Emotional Intelligence insights,   -Access to private 1-on-1 training sessions at no extra cost,   -Full access to the Premium Forex Mastery Course Program,   -Join a community of like-minded Blue Vision traders,   -24/7 direct access to mentor for ongoing support,   ",$29.99 lifetime,Blue Vision FX
a8815e17-1e1c-4b55-96ea-04df3e7f4797,Futures Trading With ARK,Single payment,"-Access to premium courses,   -Be you own boss.,   -Get into the market with confidance,   ",$50.00 lifetime,Ark_Trader Free Community
70d64062-8e11-4735-b340-78fbe44a6d87,Forex Titans Newsletter,,"-Access to Titan AI Algorithm for automated trading signals.,   -Exclusive live trading sessions with expert analysis.,   -Membership in a thriving, supportive trading community.,   ",Free lifetime,Forex Titans Titan Membership
70d64062-8e11-4735-b340-78fbe44a6d87,Forex Titans Trading Book,Single payment,"-AI-driven trading strategies for enhanced market analysis.,   -Exclusive membership in a supportive trading community.,   -Access to live trading sessions with expert market analysis.,   ",$29.99 lifetime,Forex Titans Titan Membership
70d64062-8e11-4735-b340-78fbe44a6d87,Forex Titans Titan Membership,Subscription,"-Access to Titans AI Bot for automated trading,   -Weekly market insights and trading setups,   -Membership in an elite trading community,   ",$199.99 / month,Forex Titans Titan Membership
9d9f46a8-4998-4c0d-87c9-70cd076b94b9,THM Signals,Subscription,"-All Pending orders scalping so you won't miss any trades,   -Analysis of trades called before it happens, during and after,   -Well managed and precise trades on Oil, Gold & Platinum,   -24/5 Support and Guidance in Discord,   ",$40.00 / month,THM Signals
9d9f46a8-4998-4c0d-87c9-70cd076b94b9,Live Trading,Subscription,"-Live Trading with you. Live Signals. Interactions.,   -All Pending orders scalping so you won't miss any trades,   -Well managed and precise trades on Oil, Gold & Platinum,   -24/5 Support and Guidance in Discord,   ",$60.00 / month,THM Signals
9d9f46a8-4998-4c0d-87c9-70cd076b94b9,Signals + Live Trading,Subscription,"-Both benefits of Live Trading + Signals combined,   ",$100.00 / month,THM Signals
e0dd708d-e973-4330-8029-278498a4b7a4,Olympus Trading,,"-💬Access free chat and voice channel inside the discord,   -📚Access to trade recaps, basic education, and a comprehensive beginners guide,   -❓24/7 support for any questions,   ",Free lifetime,Olympus Trading Premium
e0dd708d-e973-4330-8029-278498a4b7a4,Olympus Trading Premium,Subscription,"-🎥LIVE trade and recive alerts with Baylor Monday-Friday 8:30am CST,   -📊LIVE charting, backtesting, journal review & Q&A every Sunday at 7:15pm CST,   -🌎Daily Bias: receive Baylor’s expectations for price action every morning,   -📓Personal Trade Journal: log trades for feedback from Baylor every Sunday,   ",$75.00 / month,Olympus Trading Premium
6a959ff5-a75b-4d3d-b8c1-77daeaebcc53,LEARN AND EARN,Subscription,"-FREE COURSE PDF,   -FREE COURSE VIDEOS,   -FREE JOURNAL PDF,   -WEEKLY BREAKDOWNS,   -LIVE TRADING,   ",$54.99 / month,LEARN AND EARN
6a959ff5-a75b-4d3d-b8c1-77daeaebcc53,Chasing Pips Mentorship,Subscription,"-Lifetime VIP Discord access with live trading 💻,   -Daily and weekly check-ins for progress 📢,   -Customized trading plan tailored for you 🗒️,   -1 on 1 calls weekly,   -1 on 1 calls,   ",$650.00 / month,LEARN AND EARN
018fa14f-8813-4417-9c47-4064d38e4c28,The Trading Lab VIP,Subscription,"-Daily market analysis and trade setups from experts.,   -Morning livestreams during the London session.,   -Access to a vibrant community of dedicated traders.,   -Comprehensive trade signals from entry to exit.,   -Daily assistance for passing funded challenges.,   ",$49.00 / month,The Trading Lab VIP
018fa14f-8813-4417-9c47-4064d38e4c28,The Trading Lab VIP,Single payment,"-Daily market analysis and trade setups,   -Morning livestreams during the London session,   -Access to a community of determined traders,   -Expert insights and strategies from seasoned traders,   -Comprehensive trading signal with entry, take profit, and stop loss,   ",$400.00 lifetime,The Trading Lab VIP
32121c8c-53b1-4b3d-ae71-d7ce6870b2df,MP Forex Trading Room,Subscription,"-Codzienne przemyślenia na temat rynku i sesje live,   -Opis strategii MPforex od A do Z,   -Codzienna aktywność tradera MPforex,   ",zł350.00 / month,Aktualności
8b6a44ff-aa57-4e69-9dca-c605ce1fe394,Kaizen Trading,,"-Live trading sessions Monday to Friday with expert analysts,   -Access to premium education tailored for every member,   -Daily live trading signals from our skilled analysts,   ",Free lifetime,Kaizen Trading Premium
8b6a44ff-aa57-4e69-9dca-c605ce1fe394,Kaizen Trading Premium,Subscription,"-Live trading sessions Monday through Friday with our analyst.,   -Access to premium live education for every member.,   -Receive daily live trading signals from our expert analyst.,   ",$7.00 / week,Kaizen Trading Premium
8b6a44ff-aa57-4e69-9dca-c605ce1fe394,Kaizen Trading Premium,Subscription,"-Live trading sessions with our analyst, Monday through Friday.,   -Access to premium education tailored for every member.,   -Daily live signals provided by our expert analyst.,   ",$20.00 / month,Kaizen Trading Premium
fdc7ccc0-4e1f-425f-8e4a-5e2e5e8ba09e,Free Discord Access,,"-Real-time trade alerts from experienced market professionals.,   -Access to live market analysis and trend predictions.,   -Direct support from MikeInProfit and his team.,   -Join a vast community of dedicated traders.,   -Track ideas from our team of four expert teachers.,   ",Free lifetime,Free Discord Access
fdc7ccc0-4e1f-425f-8e4a-5e2e5e8ba09e,Profit8 Premium Discord,Subscription,"-Weekly Futures Live Trading & Discussion,   -Access to Exclusive Community Education,   -Real-Time Options & Futures Trading Alerts,   -Direct Chat Support with Experts,   -Access to All Trade Recaps & Strategies,   ",$97.00 / month,Free Discord Access
8b079edb-89af-46c6-82b0-08f45a6b73db,333 Trading Program,,"-Comprehensive coverage of Forex, stocks, and cryptocurrencies.,   -Access to live analysis, trade ideas, and in-person sessions.,   -Flexible formats: live sessions, in-person classes, on-demand lessons.,   ",Free lifetime,333 Trading Program
8b079edb-89af-46c6-82b0-08f45a6b73db,333 Trading Tier 1,Subscription,"-Strategy Mastery Exclusive Program included.,   -Access to Nadex & Forex Bootcamp.,   -1 Weekly Buddy Pass to share with friends.,   -Live Group Sessions for interactive learning.,   ",$33.00 / month,333 Trading Program
8b079edb-89af-46c6-82b0-08f45a6b73db,333 Trading Program Tier 2,Subscription,"-ALL Access To All My Education,   -Daily Live Analysis & Education,   -Private Sessions | 30min 3 Sessions Weekly,   -Special 333 Trading Strategy,   ",$533.00 / month,333 Trading Program
8b079edb-89af-46c6-82b0-08f45a6b73db,333 Trading Top Tier,Waitlist,"-ALL Access To All Education Materials,   -Daily Live Analysis & Education with Arlet,   -1 Hour Private Sessions, 6 Sessions Weekly,   -Special 333 Trading Strategy Access,   -Granted Access To 1 Add-On,   ","$3,333.00 / month",333 Trading Program
f890f942-e463-4a54-b7a4-a532b2157d56,MarsTrades Affiliates,,"-Access to a supportive Discord community for shared insights and growth,   -Comprehensive educational resources to bolster trading knowledge,   -Tools for trade mark-up and execution for seamless trading experience,   ",Free lifetime,MarsTrades Affiliates
f890f942-e463-4a54-b7a4-a532b2157d56,MarsTrades Discord,Subscription,"-Access to weekly and daily trading outlooks.,   -Engage in live trading sessions with experts.,   -Join a growing community of like-minded traders.,   -Free Discord access for 1 month every 5 months.,   -Comprehensive educational resources and support.,   ",$100.00 / month,MarsTrades Affiliates
1f5d05cc-0076-4158-a40f-e54c8ef8d2b3,Free Discord & Signals,,"-Build the foundation for your trading success,   -Learn how to manage your risk and limit losses consistently.,   -Learn how to manage funded accounts.,   -Access to our free strategies.,   ",Free lifetime,Free Discord & Signals
1f5d05cc-0076-4158-a40f-e54c8ef8d2b3,Pandora Trading VIP,Subscription,"-Daily watchlists and trade signals from our team.,   -Exclusive community access for support and networking,   -Weekly live coaching sessions with market recap.,   -Live Trading Access,   ",$5.99 / 3 days,Free Discord & Signals
98f63322-f596-459f-b89b-631344f5f15d,PoiSzn Free Community,,"-Access to Free live calls When Offered,   -24/7 access to live chat with PoiSzn,   ",Free lifetime,PoiSzn Free Community
98f63322-f596-459f-b89b-631344f5f15d,Keys To Trading London & NY,Single payment,"-Access to the Keys Course For Trading London & New York,   -Exclusive Keys Course Chat with PoiSzn,   ",$99.00 lifetime,PoiSzn Free Community
98f63322-f596-459f-b89b-631344f5f15d,PoiSzn Trading Mentorship,Subscription,"-Daily live sessions during London, New York open and New York PM sessions,   -1-on-1 Zoom calls booked through Calendly,   -Access to all educational video and text content,   -24/7 access to PoiSzn via live chat,   -Weekly group call for planning ahead,   ",$100.00 / month,PoiSzn Free Community
98f63322-f596-459f-b89b-631344f5f15d,PoiSzn 1on1 Call,Single payment,"-1.5-hour personalized trading session with PoiSzn,   -7-day premium Discord access for ongoing support,   ",$100.00 lifetime,PoiSzn Free Community
49607513-25c4-433f-b72f-7c15c9cc8348,One-on-One Coaching,Single payment,"-Schedule  consult call via teams, google meet, facetime zoom or telegram,   -1 session $100,   -4 Sessions $175,   -Lets discuss how i can help make trading simple for you.,   -Get a indepth look into how to make trading simple,   ",$100.00 lifetime,WTO Mentorship
49607513-25c4-433f-b72f-7c15c9cc8348,WTO Mentorship,Subscription,"-Exclusive study materials to boost your trading confidence.,   -Access to WTO community via Discord & Telegram for support.,   -Weekly accountability check-ins to keep you on track.,   -Free live events to enhance your trading experience.,   -Personalized trading plans for tailored success.,   ",$75.00 / month,WTO Mentorship
f33dcfad-0aa5-47c4-92ec-bda5f36debe2,$AV Forex Community,Subscription,"-Live trading sessions twice a week focusing on NYSE.,   -24/7 access to our customer support team with fast response times.,   -Exclusive educational materials to boost trading profitability.,   -Weekly webinars and livestreams for market analysis.,   ",$50.00 / month,$AV Crypto Community
f33dcfad-0aa5-47c4-92ec-bda5f36debe2,$AV Crypto Community,Subscription,"-Access to an exclusive trading community focused on meme coins.,   -24/7 customer support with lightning-fast response times.,   -Live trading sessions every Tuesday and Thursday.,   -Weekly webinars, livestreams, and more on forex markets.,   ",$100.00 / month,$AV Crypto Community
f33dcfad-0aa5-47c4-92ec-bda5f36debe2,$AV Forex+Crypto,Subscription,"-Live Forex calls every Tuesday and Thursday,   -Weekly webinars and livestreams for market analysis,   -24/7 incredible customer support with fast responses,   -Exclusive education for profitable Forex trading,   -Access to an exclusive crypto community for 100x callouts,   ",$125.00 / month,$AV Crypto Community
429422fd-7187-4425-8798-657b5070ebd0,TradeAura Premium,,"-Daily trade signals for USD/CAD and XAU/USD ensuring a consistent 10% monthly growth.,   -Access to one-on-one consultations for personalized trading advice and strategy improvement.,   -Join exclusive community events and giveaways to earn extra cash.,   -Daily market analysis to guide potential trading directions and decisions.,   -Opportunities for job offers within our committed trading community.,   ",Free lifetime,TradeAura Premium
429422fd-7187-4425-8798-657b5070ebd0,TradeAura Premium,Subscription,"-Daily trade signals and market analysis to guide your trades.,   -Access to exclusive 1-on-1 consultations for personalized advice.,   -Participation in community events and potential job offers.,   ",$49.99 / month,TradeAura Premium
